{
  "authorized_session_count": 30,
  "completed_session_count": 30,
  "derived_location": "MDS650_B1_DIAGNOSTIC_REPLICATION_DATA_ROOT/data/option_events",
  "manifest_sha256": "cd3430ebf70e77deffeadc5bd251391e6aa6d79dc72bb88a937355ea14460f93",
  "outcome_read_count": 0,
  "pending_session_count": 0,
  "pending_sessions": [],
  "personal_paths_emitted": false,
  "preregistration_sha256": "f233adb30209386d49670b8e035156d0949d5345f60421d745899eda05d58136",
  "projected_peak_additional_bytes": 49023704539,
  "provider_plan_sha256": "0d6a1f9d30ee7c04e3f51e6f31b9c048452cfd4b5cbdb39e9aa1a378a65e6b5d",
  "provider_report_sha256": "d8d078d6862d246b5fd05a0dda0e35a48abd2fd6c04b23a488dfa3f3cb2be35a",
  "raw_location": "MDS650_B1_DIAGNOSTIC_REPLICATION_DATA_ROOT/raw/full_tape",
  "schema_version": "b1-independent-replication-full-tape-1.0",
  "secret_values_emitted": false,
  "sessions": [
    {
      "checkpoint_sha256": "dfdc12cbd25883dabd461212dd2dee5273138fc457523dff81b1711ea76193e5",
      "completed_at_utc": "2026-08-15T05:27:39.860252Z",
      "derived_location": "MDS650_B1_DIAGNOSTIC_REPLICATION_DATA_ROOT/data/option_events",
      "download_attempts": 1,
      "download_seconds": 92.37442320000082,
      "duplicate_event_ids": 0,
      "filter_seconds": 339.63848190000044,
      "http_status": 200,
      "outcome_read_count": 0,
      "parquet_bytes": 137415301,
      "parquet_files": [
        {
          "bytes": 5443062,
          "relative_path": "data/option_events/date=2024-12-10/asset=AAPL/events.parquet",
          "sha256": "e6e85b4136862a3279f7a00ef0517b7273264248917fa054cb6193114b013b0d"
        },
        {
          "bytes": 4309744,
          "relative_path": "data/option_events/date=2024-12-10/asset=AMZN/events.parquet",
          "sha256": "143588d7cf70b1ccfff69ea8b554e078c8964f68aee2f32e10d899e0bec86d06"
        },
        {
          "bytes": 3851815,
          "relative_path": "data/option_events/date=2024-12-10/asset=META/events.parquet",
          "sha256": "e4ab713b449c04f389131c240225966cfcad56102dab102b4091edfe2d1aac72"
        },
        {
          "bytes": 3715184,
          "relative_path": "data/option_events/date=2024-12-10/asset=MSFT/events.parquet",
          "sha256": "dc50a044cd2834b0b45d571d56bfbe04e536c67c78bc781283cb563dd5285fbf"
        },
        {
          "bytes": 23942885,
          "relative_path": "data/option_events/date=2024-12-10/asset=NVDA/events.parquet",
          "sha256": "2eac0aaeab71907b3f84818396916bb120214b06d9437ed7d571a5079a15b8da"
        },
        {
          "bytes": 25960205,
          "relative_path": "data/option_events/date=2024-12-10/asset=QQQ/events.parquet",
          "sha256": "32fcf2f532b81b5c060c5bbb4e7872d64f058dfe19a589636ac8e96f8780bb5a"
        },
        {
          "bytes": 35058878,
          "relative_path": "data/option_events/date=2024-12-10/asset=SPY/events.parquet",
          "sha256": "7982ef55df9458d8736b449829a08ed4ec65880a0982d240519a63e2eecf181a"
        },
        {
          "bytes": 35133528,
          "relative_path": "data/option_events/date=2024-12-10/asset=TSLA/events.parquet",
          "sha256": "3ed413c482360b16cd9ea39db2525471f2392b33480e5bc45bb4605a452f17a0"
        }
      ],
      "personal_paths_emitted": false,
      "preregistration_sha256": "f233adb30209386d49670b8e035156d0949d5345f60421d745899eda05d58136",
      "provider_plan_sha256": "0d6a1f9d30ee7c04e3f51e6f31b9c048452cfd4b5cbdb39e9aa1a378a65e6b5d",
      "provider_report_sha256": "d8d078d6862d246b5fd05a0dda0e35a48abd2fd6c04b23a488dfa3f3cb2be35a",
      "raw_bytes": 900916435,
      "raw_location": "MDS650_B1_DIAGNOSTIC_REPLICATION_DATA_ROOT/raw/full_tape",
      "raw_sha256": "56d087eef26419313ea6c4a62babe860958739210e9e704655193e47d20f2337",
      "request_endpoint": "/api/option-trades/full-tape/{date}",
      "request_id": null,
      "reused_raw_archive": false,
      "rows_retained": 2380643,
      "rows_seen": 6484276,
      "schema_fields": [
        "aggregated_trade_id",
        "alert_score",
        "ask_vol",
        "bid_vol",
        "canceled",
        "created_at",
        "delta",
        "ewma_nbbo_ask",
        "ewma_nbbo_bid",
        "exchange",
        "executed_at",
        "expiry",
        "gamma",
        "id",
        "implied_volatility",
        "market_center_locate",
        "mid_vol",
        "multi_vol",
        "nbbo_ask",
        "nbbo_bid",
        "no_side_vol",
        "open_interest",
        "option_chain_id",
        "option_type",
        "premium",
        "price",
        "report_flags",
        "rho",
        "size",
        "stock_multi_vol",
        "strike",
        "tags",
        "theo",
        "theta",
        "trade_id",
        "underlying_price",
        "underlying_symbol",
        "upstream_condition_detail",
        "vega",
        "volume"
      ],
      "schema_fingerprint": "3a2285fa84f0683df7334cbf0d6670805ea3a7b007c4b5a511779e7c4413581d",
      "secret_values_emitted": false,
      "session_contract_sha256": "ccc39b3e743bcaf0b18232bacc0f1759b5f9fa0e53dc48b3ab1e2b2b74bfc0f6",
      "session_date": "2024-12-10",
      "source_kind": "AUTHENTICATED_DOWNLOAD",
      "status": "PASS",
      "target_outcome_read": false
    },
    {
      "checkpoint_sha256": "84f39bd77f9457eb16fd1c0bd886201e81b13bd15a8f8a324e592104dd69a7b7",
      "completed_at_utc": "2026-08-15T05:34:59.521146Z",
      "derived_location": "MDS650_B1_DIAGNOSTIC_REPLICATION_DATA_ROOT/data/option_events",
      "download_attempts": 1,
      "download_seconds": 83.85383000000002,
      "duplicate_event_ids": 0,
      "filter_seconds": 355.6560521000001,
      "http_status": 200,
      "outcome_read_count": 0,
      "parquet_bytes": 141580743,
      "parquet_files": [
        {
          "bytes": 8406304,
          "relative_path": "data/option_events/date=2024-12-11/asset=AAPL/events.parquet",
          "sha256": "e8d7134aa16ef8557487b7b217ed677a0d8fcd339dcee01369b1fbfe84d80b99"
        },
        {
          "bytes": 5984766,
          "relative_path": "data/option_events/date=2024-12-11/asset=AMZN/events.parquet",
          "sha256": "9a932531cd5b2087594ea7f7fdd36905288edfd621f478c87ccc1c6ef2ee2517"
        },
        {
          "bytes": 5851479,
          "relative_path": "data/option_events/date=2024-12-11/asset=META/events.parquet",
          "sha256": "8fccbdf1401421e32d4167b8d1c2123deabf5193ee5fde526e692f4fee347f79"
        },
        {
          "bytes": 3294308,
          "relative_path": "data/option_events/date=2024-12-11/asset=MSFT/events.parquet",
          "sha256": "55fbed24dd4100c898027ac8270d37f579f1983d4e4e8c0314083844ea04c245"
        },
        {
          "bytes": 21865496,
          "relative_path": "data/option_events/date=2024-12-11/asset=NVDA/events.parquet",
          "sha256": "4c2cc6657dcdf2b5ff3accc6f6dbc99566f7941dceba1c03c536e1aaf0561cc2"
        },
        {
          "bytes": 25926106,
          "relative_path": "data/option_events/date=2024-12-11/asset=QQQ/events.parquet",
          "sha256": "03109c07a287eb9eec5e3a11933c62bdae6d90a17fc3a87c8ae63b756dcf3f25"
        },
        {
          "bytes": 33501975,
          "relative_path": "data/option_events/date=2024-12-11/asset=SPY/events.parquet",
          "sha256": "7881805eaa3eed19124aaaefc881378d91e822c622f687bdf364920dc21e8a35"
        },
        {
          "bytes": 36750309,
          "relative_path": "data/option_events/date=2024-12-11/asset=TSLA/events.parquet",
          "sha256": "89b57b48d69ba929658c5254aff081da72515cd71fc6910da1fc0944a705455f"
        }
      ],
      "personal_paths_emitted": false,
      "preregistration_sha256": "f233adb30209386d49670b8e035156d0949d5345f60421d745899eda05d58136",
      "provider_plan_sha256": "0d6a1f9d30ee7c04e3f51e6f31b9c048452cfd4b5cbdb39e9aa1a378a65e6b5d",
      "provider_report_sha256": "d8d078d6862d246b5fd05a0dda0e35a48abd2fd6c04b23a488dfa3f3cb2be35a",
      "raw_bytes": 939984642,
      "raw_location": "MDS650_B1_DIAGNOSTIC_REPLICATION_DATA_ROOT/raw/full_tape",
      "raw_sha256": "fe2c120d619032273e8609e8b3cb7e8acafde7e2def4447c58a22e155a15133e",
      "request_endpoint": "/api/option-trades/full-tape/{date}",
      "request_id": null,
      "reused_raw_archive": false,
      "rows_retained": 2446013,
      "rows_seen": 6792001,
      "schema_fields": [
        "aggregated_trade_id",
        "alert_score",
        "ask_vol",
        "bid_vol",
        "canceled",
        "created_at",
        "delta",
        "ewma_nbbo_ask",
        "ewma_nbbo_bid",
        "exchange",
        "executed_at",
        "expiry",
        "gamma",
        "id",
        "implied_volatility",
        "market_center_locate",
        "mid_vol",
        "multi_vol",
        "nbbo_ask",
        "nbbo_bid",
        "no_side_vol",
        "open_interest",
        "option_chain_id",
        "option_type",
        "premium",
        "price",
        "report_flags",
        "rho",
        "size",
        "stock_multi_vol",
        "strike",
        "tags",
        "theo",
        "theta",
        "trade_id",
        "underlying_price",
        "underlying_symbol",
        "upstream_condition_detail",
        "vega",
        "volume"
      ],
      "schema_fingerprint": "3a2285fa84f0683df7334cbf0d6670805ea3a7b007c4b5a511779e7c4413581d",
      "secret_values_emitted": false,
      "session_contract_sha256": "6edc6852999d3bbd63cc0746cef4c600d117b4a1faff496966d5b0c1558027f4",
      "session_date": "2024-12-11",
      "source_kind": "AUTHENTICATED_DOWNLOAD",
      "status": "PASS",
      "target_outcome_read": false
    },
    {
      "checkpoint_sha256": "cf4578f30bc41a826462e086b418fcb74af4a55e8fdb47c87bc246c6ce4cdf3a",
      "completed_at_utc": "2026-08-15T05:40:57.144023Z",
      "derived_location": "MDS650_B1_DIAGNOSTIC_REPLICATION_DATA_ROOT/data/option_events",
      "download_attempts": 1,
      "download_seconds": 75.52813929999957,
      "duplicate_event_ids": 0,
      "filter_seconds": 281.9723715,